a green and green grass, the front of a boat, the sky is cloudy, the mountains are in the background, a fire hydrant in the water
the sky is cloudy, the water is calm, the water is dark, a large rock, a large body of water
a picture of a horse, a boat in the water, the sky is cloudy, the sky is white, the water is white
the water is clear, the sky is cloudy, a blue and white horse, the shadow of the giraffe, a large black pole
the water is calm, the sky is very cloudy, the rock is brown, the water is brown, the mountains are in the background
Uanna = presence, Guanyin = abscence, Kali = presence, Mami Wata = abscence, Mami Wata = abscence
